{
  "schemaVersion": "1.0",
  "messageId": "5b7e1a92-3c48-4f06-b1d5-8e2a94c7f013",
  "messageType": "MISSION_COMMAND",
  "robotId": "SENTINEL-01",
  "missionId": "4a43f45c-779f-4df5-ac04-1695724829a4",
  "sequence": 1753760000000,
  "sentAt": "2026-07-29T05:10:00.000Z",
  "data": {
    "commandId": "40ac11fb-4d02-4214-b9ae-6d66f44f1964",
    "type": "START"
  }
}
