{
  "schemaVersion": "1.0",
  "messageId": "6d3f9a10-2b54-4c8e-9f71-1a0e5c8b3d92",
  "messageType": "ROBOT_PRESENCE",
  "robotId": "SENTINEL-01",
  "missionId": null,
  "sequence": 0,
  "sentAt": "2026-07-28T03:11:58.000Z",
  "data": {
    "robotId": "SENTINEL-01",
    "status": "ONLINE",
    "reason": null
  }
}
